{"$schema":"https://json-schema.org/draft/2020-12/schema","$id":"https://nxb.local/schemas/memory-etl-summary.schema.json","title":"NXB Memory ETL Event Summary","type":"object","required":["schema_version","summary_id","experiment_id","experiment_relative_path","machine_id","boot_id","trace_sha256","profile_sha256","event_export_sha256","adapter_sha256","source_format","trace_start_utc","trace_end_utc","target","quality","events","processes","summary","claims"],"additionalProperties":false,"properties":{"schema_version":{"const":1},"summary_id":{"$ref":"#/$defs/identifier"},"experiment_id":{"$ref":"#/$defs/identifier"},"experiment_relative_path":{"type":"string","pattern":"^experiments/[A-Za-z0-9._-]+$"},"machine_id":{"type":"string","minLength":1,"maxLength":512},"boot_id":{"$ref":"#/$defs/sha256"},"trace_sha256":{"$ref":"#/$defs/sha256"},"profile_sha256":{"$ref":"#/$defs/sha256"},"adapter_sha256":{"$ref":"#/$defs/sha256"},"source_format":{"enum":["nxb_memory_event_export_v1","synthetic_fixture"]},"trace_start_utc":{"type":"string","format":"date-time"},"trace_end_utc":{"type":"string","format":"date-time"},"target":{"$ref":"#/$defs/target"},"quality":{"$ref":"#/$defs/quality"},"events":{"type":"object","required":["hard_fault","demand_zero_fault","copy_on_write_fault","transition_fault","guard_page_fault","soft_fault_total","virtual_allocation","virtual_free","mapped_section_create","mapped_section_delete"],"additionalProperties":false,"properties":{"hard_fault":{"$ref":"#/$defs/eventAggregate"},"demand_zero_fault":{"$ref":"#/$defs/eventAggregate"},"copy_on_write_fault":{"$ref":"#/$defs/eventAggregate"},"transition_fault":{"$ref":"#/$defs/eventAggregate"},"guard_page_fault":{"$ref":"#/$defs/eventAggregate"},"soft_fault_total":{"$ref":"#/$defs/eventAggregate"},"virtual_allocation":{"$ref":"#/$defs/eventAggregate"},"virtual_free":{"$ref":"#/$defs/eventAggregate"},"mapped_section_create":{"$ref":"#/$defs/eventAggregate"},"mapped_section_delete":{"$ref":"#/$defs/eventAggregate"}}},"processes":{"type":"array","minItems":1,"maxItems":4096,"items":{"$ref":"#/$defs/processSummary"}},"summary":{"$ref":"#/$defs/summary"},"claims":{"$ref":"#/$defs/claims"},"event_export_sha256":{"$ref":"#/$defs/sha256"}},"$defs":{"identifier":{"type":"string","minLength":1,"maxLength":128,"pattern":"^[A-Za-z0-9._:-]+$"},"sha256":{"type":"string","pattern":"^[0-9a-f]{64}$"},"source":{"type":"object","required":["collector","kind","provenance_sha256"],"additionalProperties":false,"properties":{"collector":{"const":"ConvertFrom-NxbMemoryEventExport.ps1"},"kind":{"enum":["etw_summary","synthetic_fixture"]},"provenance_sha256":{"$ref":"#/$defs/sha256"}}},"eventAggregate":{"oneOf":[{"type":"object","required":["status","count","bytes","unattributed_count","attribution","source","reason"],"additionalProperties":false,"properties":{"status":{"const":"measured"},"count":{"type":"integer","minimum":0},"bytes":{"type":["integer","null"],"minimum":0},"unattributed_count":{"type":"integer","minimum":0},"attribution":{"enum":["complete","partial","none"]},"source":{"$ref":"#/$defs/source"},"reason":{"type":"null"}}},{"type":"object","required":["status","count","bytes","unattributed_count","attribution","source","reason"],"additionalProperties":false,"properties":{"status":{"enum":["unsupported","unavailable","failed","not_assessed"]},"count":{"type":"null"},"bytes":{"type":"null"},"unattributed_count":{"type":"null"},"attribution":{"const":"none"},"source":{"oneOf":[{"$ref":"#/$defs/source"},{"type":"null"}]},"reason":{"type":"string","minLength":1}}}]},"eventCount":{"oneOf":[{"type":"object","required":["status","count","bytes","source","reason"],"additionalProperties":false,"properties":{"status":{"const":"measured"},"count":{"type":"integer","minimum":0},"bytes":{"type":["integer","null"],"minimum":0},"source":{"$ref":"#/$defs/source"},"reason":{"type":"null"}}},{"type":"object","required":["status","count","bytes","source","reason"],"additionalProperties":false,"properties":{"status":{"enum":["unsupported","unavailable","failed","not_assessed"]},"count":{"type":"null"},"bytes":{"type":"null"},"source":{"oneOf":[{"$ref":"#/$defs/source"},{"type":"null"}]},"reason":{"type":"string","minLength":1}}}]},"target":{"type":"object","required":["process_id","process_start_utc","image_sha256"],"additionalProperties":false,"properties":{"process_id":{"type":"integer","minimum":1},"process_start_utc":{"type":"string","format":"date-time"},"image_sha256":{"$ref":"#/$defs/sha256"}}},"quality":{"type":"object","required":["trace_loss","circular_overwrite","parser_completeness","unsupported_event_types"],"additionalProperties":false,"properties":{"trace_loss":{"enum":["none","present","unknown"]},"circular_overwrite":{"enum":["none","possible","confirmed","unknown"]},"parser_completeness":{"enum":["complete","partial","failed"]},"unsupported_event_types":{"type":"array","uniqueItems":true,"items":{"enum":["hard_fault","demand_zero_fault","copy_on_write_fault","transition_fault","guard_page_fault","soft_fault_total","virtual_allocation","virtual_free","mapped_section_create","mapped_section_delete"]}}}},"processSummary":{"type":"object","required":["process_id","process_start_utc","image_sha256","identity_status","is_target","events"],"additionalProperties":false,"properties":{"process_id":{"type":"integer","minimum":1},"process_start_utc":{"type":["string","null"],"format":"date-time"},"image_sha256":{"oneOf":[{"$ref":"#/$defs/sha256"},{"type":"null"}]},"identity_status":{"enum":["complete","partial"]},"is_target":{"type":"boolean"},"events":{"type":"object","required":["hard_fault","demand_zero_fault","copy_on_write_fault","transition_fault","guard_page_fault","soft_fault_total","virtual_allocation","virtual_free","mapped_section_create","mapped_section_delete"],"additionalProperties":false,"properties":{"hard_fault":{"$ref":"#/$defs/eventCount"},"demand_zero_fault":{"$ref":"#/$defs/eventCount"},"copy_on_write_fault":{"$ref":"#/$defs/eventCount"},"transition_fault":{"$ref":"#/$defs/eventCount"},"guard_page_fault":{"$ref":"#/$defs/eventCount"},"soft_fault_total":{"$ref":"#/$defs/eventCount"},"virtual_allocation":{"$ref":"#/$defs/eventCount"},"virtual_free":{"$ref":"#/$defs/eventCount"},"mapped_section_create":{"$ref":"#/$defs/eventCount"},"mapped_section_delete":{"$ref":"#/$defs/eventCount"}}}}},"summary":{"type":"object","required":["process_count","measured_event_class_count","failed_event_class_count","evidence_completeness"],"additionalProperties":false,"properties":{"process_count":{"type":"integer","minimum":1,"maximum":4096},"measured_event_class_count":{"type":"integer","minimum":0,"maximum":10},"failed_event_class_count":{"type":"integer","minimum":0,"maximum":10},"evidence_completeness":{"enum":["complete","partial","unavailable","failed"]}}},"claims":{"type":"object","required":["hard_fault_absence","soft_fault_absence","virtual_memory_balance","trace_completeness"],"additionalProperties":false,"properties":{"hard_fault_absence":{"const":false},"soft_fault_absence":{"const":false},"virtual_memory_balance":{"const":false},"trace_completeness":{"const":"not_claimed"}}}}}