{"schema_version":1,"summary_id":"memory-etl-summary-fixture-001","experiment_id":"fixture-memory-etl-001","experiment_relative_path":"experiments/fixture-memory-etl-001","machine_id":"fixture-machine","boot_id":"bbbbbbbbbbbbbbbbbbbbbbbbbbbbbbbbbbbbbbbbbbbbbbbbbbbbbbbbbbbbbbbb","trace_sha256":"cccccccccccccccccccccccccccccccccccccccccccccccccccccccccccccccc","profile_sha256":"dddddddddddddddddddddddddddddddddddddddddddddddddddddddddddddddd","event_export_sha256":"ffffffffffffffffffffffffffffffffffffffffffffffffffffffffffffffff","adapter_sha256":"aaaaaaaaaaaaaaaaaaaaaaaaaaaaaaaaaaaaaaaaaaaaaaaaaaaaaaaaaaaaaaaa","source_format":"synthetic_fixture","trace_start_utc":"2026-08-06T22:00:00Z","trace_end_utc":"2026-08-06T22:00:10Z","target":{"process_id":4242,"process_start_utc":"2026-08-06T21:59:00Z","image_sha256":"eeeeeeeeeeeeeeeeeeeeeeeeeeeeeeeeeeeeeeeeeeeeeeeeeeeeeeeeeeeeeeee"},"quality":{"trace_loss":"none","circular_overwrite":"none","parser_completeness":"complete","unsupported_event_types":[]},"events":{"hard_fault":{"status":"measured","count":3,"bytes":12288,"unattributed_count":0,"attribution":"complete","source":{"collector":"ConvertFrom-NxbMemoryEventExport.ps1","kind":"synthetic_fixture","provenance_sha256":"aaaaaaaaaaaaaaaaaaaaaaaaaaaaaaaaaaaaaaaaaaaaaaaaaaaaaaaaaaaaaaaa"},"reason":null},"demand_zero_fault":{"status":"measured","count":4,"bytes":null,"unattributed_count":0,"attribution":"complete","source":{"collector":"ConvertFrom-NxbMemoryEventExport.ps1","kind":"synthetic_fixture","provenance_sha256":"aaaaaaaaaaaaaaaaaaaaaaaaaaaaaaaaaaaaaaaaaaaaaaaaaaaaaaaaaaaaaaaa"},"reason":null},"copy_on_write_fault":{"status":"measured","count":2,"bytes":null,"unattributed_count":0,"attribution":"complete","source":{"collector":"ConvertFrom-NxbMemoryEventExport.ps1","kind":"synthetic_fixture","provenance_sha256":"aaaaaaaaaaaaaaaaaaaaaaaaaaaaaaaaaaaaaaaaaaaaaaaaaaaaaaaaaaaaaaaa"},"reason":null},"transition_fault":{"status":"measured","count":3,"bytes":null,"unattributed_count":0,"attribution":"complete","source":{"collector":"ConvertFrom-NxbMemoryEventExport.ps1","kind":"synthetic_fixture","provenance_sha256":"aaaaaaaaaaaaaaaaaaaaaaaaaaaaaaaaaaaaaaaaaaaaaaaaaaaaaaaaaaaaaaaa"},"reason":null},"guard_page_fault":{"status":"measured","count":0,"bytes":null,"unattributed_count":0,"attribution":"complete","source":{"collector":"ConvertFrom-NxbMemoryEventExport.ps1","kind":"synthetic_fixture","provenance_sha256":"aaaaaaaaaaaaaaaaaaaaaaaaaaaaaaaaaaaaaaaaaaaaaaaaaaaaaaaaaaaaaaaa"},"reason":null},"soft_fault_total":{"status":"measured","count":9,"bytes":null,"unattributed_count":0,"attribution":"complete","source":{"collector":"ConvertFrom-NxbMemoryEventExport.ps1","kind":"synthetic_fixture","provenance_sha256":"aaaaaaaaaaaaaaaaaaaaaaaaaaaaaaaaaaaaaaaaaaaaaaaaaaaaaaaaaaaaaaaa"},"reason":null},"virtual_allocation":{"status":"measured","count":2,"bytes":12288,"unattributed_count":0,"attribution":"complete","source":{"collector":"ConvertFrom-NxbMemoryEventExport.ps1","kind":"synthetic_fixture","provenance_sha256":"aaaaaaaaaaaaaaaaaaaaaaaaaaaaaaaaaaaaaaaaaaaaaaaaaaaaaaaaaaaaaaaa"},"reason":null},"virtual_free":{"status":"measured","count":1,"bytes":4096,"unattributed_count":0,"attribution":"complete","source":{"collector":"ConvertFrom-NxbMemoryEventExport.ps1","kind":"synthetic_fixture","provenance_sha256":"aaaaaaaaaaaaaaaaaaaaaaaaaaaaaaaaaaaaaaaaaaaaaaaaaaaaaaaaaaaaaaaa"},"reason":null},"mapped_section_create":{"status":"measured","count":1,"bytes":null,"unattributed_count":0,"attribution":"complete","source":{"collector":"ConvertFrom-NxbMemoryEventExport.ps1","kind":"synthetic_fixture","provenance_sha256":"aaaaaaaaaaaaaaaaaaaaaaaaaaaaaaaaaaaaaaaaaaaaaaaaaaaaaaaaaaaaaaaa"},"reason":null},"mapped_section_delete":{"status":"measured","count":1,"bytes":null,"unattributed_count":0,"attribution":"complete","source":{"collector":"ConvertFrom-NxbMemoryEventExport.ps1","kind":"synthetic_fixture","provenance_sha256":"aaaaaaaaaaaaaaaaaaaaaaaaaaaaaaaaaaaaaaaaaaaaaaaaaaaaaaaaaaaaaaaa"},"reason":null}},"processes":[{"process_id":4242,"process_start_utc":"2026-08-06T21:59:00Z","image_sha256":"eeeeeeeeeeeeeeeeeeeeeeeeeeeeeeeeeeeeeeeeeeeeeeeeeeeeeeeeeeeeeeee","identity_status":"complete","is_target":true,"events":{"hard_fault":{"status":"measured","count":2,"bytes":8192,"source":{"collector":"ConvertFrom-NxbMemoryEventExport.ps1","kind":"synthetic_fixture","provenance_sha256":"aaaaaaaaaaaaaaaaaaaaaaaaaaaaaaaaaaaaaaaaaaaaaaaaaaaaaaaaaaaaaaaa"},"reason":null},"demand_zero_fault":{"status":"measured","count":3,"bytes":null,"source":{"collector":"ConvertFrom-NxbMemoryEventExport.ps1","kind":"synthetic_fixture","provenance_sha256":"aaaaaaaaaaaaaaaaaaaaaaaaaaaaaaaaaaaaaaaaaaaaaaaaaaaaaaaaaaaaaaaa"},"reason":null},"copy_on_write_fault":{"status":"measured","count":1,"bytes":null,"source":{"collector":"ConvertFrom-NxbMemoryEventExport.ps1","kind":"synthetic_fixture","provenance_sha256":"aaaaaaaaaaaaaaaaaaaaaaaaaaaaaaaaaaaaaaaaaaaaaaaaaaaaaaaaaaaaaaaa"},"reason":null},"transition_fault":{"status":"measured","count":2,"bytes":null,"source":{"collector":"ConvertFrom-NxbMemoryEventExport.ps1","kind":"synthetic_fixture","provenance_sha256":"aaaaaaaaaaaaaaaaaaaaaaaaaaaaaaaaaaaaaaaaaaaaaaaaaaaaaaaaaaaaaaaa"},"reason":null},"guard_page_fault":{"status":"measured","count":0,"bytes":null,"source":{"collector":"ConvertFrom-NxbMemoryEventExport.ps1","kind":"synthetic_fixture","provenance_sha256":"aaaaaaaaaaaaaaaaaaaaaaaaaaaaaaaaaaaaaaaaaaaaaaaaaaaaaaaaaaaaaaaa"},"reason":null},"soft_fault_total":{"status":"measured","count":6,"bytes":null,"source":{"collector":"ConvertFrom-NxbMemoryEventExport.ps1","kind":"synthetic_fixture","provenance_sha256":"aaaaaaaaaaaaaaaaaaaaaaaaaaaaaaaaaaaaaaaaaaaaaaaaaaaaaaaaaaaaaaaa"},"reason":null},"virtual_allocation":{"status":"measured","count":1,"bytes":4096,"source":{"collector":"ConvertFrom-NxbMemoryEventExport.ps1","kind":"synthetic_fixture","provenance_sha256":"aaaaaaaaaaaaaaaaaaaaaaaaaaaaaaaaaaaaaaaaaaaaaaaaaaaaaaaaaaaaaaaa"},"reason":null},"virtual_free":{"status":"measured","count":1,"bytes":4096,"source":{"collector":"ConvertFrom-NxbMemoryEventExport.ps1","kind":"synthetic_fixture","provenance_sha256":"aaaaaaaaaaaaaaaaaaaaaaaaaaaaaaaaaaaaaaaaaaaaaaaaaaaaaaaaaaaaaaaa"},"reason":null},"mapped_section_create":{"status":"measured","count":1,"bytes":null,"source":{"collector":"ConvertFrom-NxbMemoryEventExport.ps1","kind":"synthetic_fixture","provenance_sha256":"aaaaaaaaaaaaaaaaaaaaaaaaaaaaaaaaaaaaaaaaaaaaaaaaaaaaaaaaaaaaaaaa"},"reason":null},"mapped_section_delete":{"status":"measured","count":1,"bytes":null,"source":{"collector":"ConvertFrom-NxbMemoryEventExport.ps1","kind":"synthetic_fixture","provenance_sha256":"aaaaaaaaaaaaaaaaaaaaaaaaaaaaaaaaaaaaaaaaaaaaaaaaaaaaaaaaaaaaaaaa"},"reason":null}}},{"process_id":5252,"process_start_utc":null,"image_sha256":null,"identity_status":"partial","is_target":false,"events":{"hard_fault":{"status":"measured","count":1,"bytes":4096,"source":{"collector":"ConvertFrom-NxbMemoryEventExport.ps1","kind":"synthetic_fixture","provenance_sha256":"aaaaaaaaaaaaaaaaaaaaaaaaaaaaaaaaaaaaaaaaaaaaaaaaaaaaaaaaaaaaaaaa"},"reason":null},"demand_zero_fault":{"status":"measured","count":1,"bytes":null,"source":{"collector":"ConvertFrom-NxbMemoryEventExport.ps1","kind":"synthetic_fixture","provenance_sha256":"aaaaaaaaaaaaaaaaaaaaaaaaaaaaaaaaaaaaaaaaaaaaaaaaaaaaaaaaaaaaaaaa"},"reason":null},"copy_on_write_fault":{"status":"measured","count":1,"bytes":null,"source":{"collector":"ConvertFrom-NxbMemoryEventExport.ps1","kind":"synthetic_fixture","provenance_sha256":"aaaaaaaaaaaaaaaaaaaaaaaaaaaaaaaaaaaaaaaaaaaaaaaaaaaaaaaaaaaaaaaa"},"reason":null},"transition_fault":{"status":"measured","count":1,"bytes":null,"source":{"collector":"ConvertFrom-NxbMemoryEventExport.ps1","kind":"synthetic_fixture","provenance_sha256":"aaaaaaaaaaaaaaaaaaaaaaaaaaaaaaaaaaaaaaaaaaaaaaaaaaaaaaaaaaaaaaaa"},"reason":null},"guard_page_fault":{"status":"measured","count":0,"bytes":null,"source":{"collector":"ConvertFrom-NxbMemoryEventExport.ps1","kind":"synthetic_fixture","provenance_sha256":"aaaaaaaaaaaaaaaaaaaaaaaaaaaaaaaaaaaaaaaaaaaaaaaaaaaaaaaaaaaaaaaa"},"reason":null},"soft_fault_total":{"status":"measured","count":3,"bytes":null,"source":{"collector":"ConvertFrom-NxbMemoryEventExport.ps1","kind":"synthetic_fixture","provenance_sha256":"aaaaaaaaaaaaaaaaaaaaaaaaaaaaaaaaaaaaaaaaaaaaaaaaaaaaaaaaaaaaaaaa"},"reason":null},"virtual_allocation":{"status":"measured","count":1,"bytes":8192,"source":{"collector":"ConvertFrom-NxbMemoryEventExport.ps1","kind":"synthetic_fixture","provenance_sha256":"aaaaaaaaaaaaaaaaaaaaaaaaaaaaaaaaaaaaaaaaaaaaaaaaaaaaaaaaaaaaaaaa"},"reason":null},"virtual_free":{"status":"measured","count":0,"bytes":0,"source":{"collector":"ConvertFrom-NxbMemoryEventExport.ps1","kind":"synthetic_fixture","provenance_sha256":"aaaaaaaaaaaaaaaaaaaaaaaaaaaaaaaaaaaaaaaaaaaaaaaaaaaaaaaaaaaaaaaa"},"reason":null},"mapped_section_create":{"status":"measured","count":0,"bytes":null,"source":{"collector":"ConvertFrom-NxbMemoryEventExport.ps1","kind":"synthetic_fixture","provenance_sha256":"aaaaaaaaaaaaaaaaaaaaaaaaaaaaaaaaaaaaaaaaaaaaaaaaaaaaaaaaaaaaaaaa"},"reason":null},"mapped_section_delete":{"status":"measured","count":0,"bytes":null,"source":{"collector":"ConvertFrom-NxbMemoryEventExport.ps1","kind":"synthetic_fixture","provenance_sha256":"aaaaaaaaaaaaaaaaaaaaaaaaaaaaaaaaaaaaaaaaaaaaaaaaaaaaaaaaaaaaaaaa"},"reason":null}}}],"summary":{"process_count":2,"measured_event_class_count":10,"failed_event_class_count":0,"evidence_completeness":"complete"},"claims":{"hard_fault_absence":false,"soft_fault_absence":false,"virtual_memory_balance":false,"trace_completeness":"not_claimed"}}